{
    "schemaVersion":  1,
    "updatedAt":  "2026-06-26T07:26:43Z",
    "publisher":  "bahungbnck99",
    "assets":  {
                   "fonts":  {
                                 "manifestUrl":  "https://raw.githubusercontent.com/bahungbnck99/app-runtime-assets/main/manifests/fonts.json",
                                 "requiredBy":  [
                                                    "download-multi-platform"
                                                ],
                                 "optional":  false
                             }
               }
}